[
  {
    "id": "areas/act1-blood-moor",
    "name": "maps.area.act1-blood-moor",
    "actId": "acts/act1",
    "areaLevel": 2,
    "hasBoss": false,
    "lootTable": "loot/trash-act1",
    "flavor": "Wind-scoured grasslands east of the Rogue Encampment, choked with carvers and shambling dead.",
    "waves": [
      {
        "id": "w1",
        "type": "trash",
        "encounters": [
          {
            "id": "act1-blood-moor-w1-e1",
            "level": 2,
            "monsters": [
              {
                "archetypeId": "monsters/act1.fallen",
                "count": 3
              },
              {
                "archetypeId": "monsters/act1.quill-rat",
                "count": 1
              }
            ]
          }
        ]
      },
      {
        "id": "w2",
        "type": "trash",
        "encounters": [
          {
            "id": "act1-blood-moor-w2-e1",
            "level": 2,
            "monsters": [
              {
                "archetypeId": "monsters/act1.fallen",
                "count": 2
              },
              {
                "archetypeId": "monsters/act1.fallen-shaman",
                "count": 1
              },
              {
                "archetypeId": "monsters/act1.zombie",
                "count": 1
              }
            ]
          }
        ]
      },
      {
        "id": "w3",
        "type": "trash",
        "encounters": [
          {
            "id": "act1-blood-moor-w3-e1",
            "level": 3,
            "monsters": [
              {
                "archetypeId": "monsters/act1.zombie",
                "count": 2
              },
              {
                "archetypeId": "monsters/act1.quill-rat",
                "count": 2
              }
            ]
          }
        ]
      }
    ],
    "challenge": {
      "rotation": [
        "trash",
        "trash",
        "elite",
        "trash"
      ],
      "manualFinalEliteWaves": 2,
      "appendChapterBoss": true,
      "monsterCount": {
        "min": 8,
        "max": 20
      }
    },
    "difficulty": {
      "finaleBand": "none",
      "monsterLevelBonus": 0
    }
  },
  {
    "id": "areas/act1-den-of-evil",
    "name": "maps.area.act1-den-of-evil",
    "actId": "acts/act1",
    "areaLevel": 3,
    "hasBoss": true,
    "lootTable": "loot/trash-act1",
    "flavor": "A fetid cave reeking of rotting carvers; the Dark One presides over the slaughter pit.",
    "bossEncounter": {
      "id": "act1-den-of-evil-boss",
      "level": 4,
      "monsters": [
        {
          "archetypeId": "monsters/act1.carver",
          "count": 1,
          "boss": true
        },
        {
          "archetypeId": "monsters/act1.carver",
          "count": 2
        }
      ]
    },
    "waves": [
      {
        "id": "w1",
        "type": "trash",
        "encounters": [
          {
            "id": "act1-den-w1-e1",
            "level": 3,
            "monsters": [
              {
                "archetypeId": "monsters/act1.fallen",
                "count": 4
              }
            ]
          }
        ]
      },
      {
        "id": "w2",
        "type": "trash",
        "encounters": [
          {
            "id": "act1-den-w2-e1",
            "level": 3,
            "monsters": [
              {
                "archetypeId": "monsters/act1.fallen",
                "count": 2
              },
              {
                "archetypeId": "monsters/act1.fallen-shaman",
                "count": 1
              },
              {
                "archetypeId": "monsters/act1.tainted",
                "count": 1
              }
            ]
          }
        ]
      },
      {
        "id": "w3",
        "type": "elite",
        "encounters": [
          {
            "id": "act1-den-w3-e1",
            "level": 4,
            "monsters": [
              {
                "archetypeId": "monsters/act1.dark-stalker",
                "count": 2,
                "elite": true
              },
              {
                "archetypeId": "monsters/act1.fallen",
                "count": 2
              }
            ]
          }
        ]
      },
      {
        "id": "w4",
        "type": "boss",
        "lootTable": "loot/mini-act1",
        "encounters": [
          {
            "id": "act1-den-w4-e1",
            "level": 4,
            "monsters": [
              {
                "archetypeId": "monsters/act1.carver",
                "count": 1,
                "boss": true
              }
            ]
          }
        ]
      }
    ],
    "challenge": {
      "rotation": [
        "trash",
        "trash",
        "elite",
        "trash"
      ],
      "manualFinalEliteWaves": 2,
      "appendChapterBoss": true,
      "monsterCount": {
        "min": 8,
        "max": 20
      }
    },
    "difficulty": {
      "finaleBand": "none",
      "monsterLevelBonus": 0
    }
  },
  {
    "id": "areas/act1-cold-plains",
    "name": "maps.area.act1-cold-plains",
    "actId": "acts/act1",
    "areaLevel": 5,
    "hasBoss": false,
    "lootTable": "loot/trash-act1",
    "flavor": "Snow-dusted heath where skeleton archers loose volleys from broken cairns.",
    "waves": [
      {
        "id": "w1",
        "type": "trash",
        "encounters": [
          {
            "id": "act1-cp-w1-e1",
            "level": 5,
            "monsters": [
              {
                "archetypeId": "monsters/act1.zombie",
                "count": 3
              },
              {
                "archetypeId": "monsters/act1.dark-archer",
                "count": 1
              }
            ]
          }
        ]
      },
      {
        "id": "w2",
        "type": "trash",
        "encounters": [
          {
            "id": "act1-cp-w2-e1",
            "level": 5,
            "monsters": [
              {
                "archetypeId": "monsters/act1.tainted",
                "count": 2
              },
              {
                "archetypeId": "monsters/act1.dark-archer",
                "count": 2
              }
            ]
          }
        ]
      },
      {
        "id": "w3",
        "type": "trash",
        "encounters": [
          {
            "id": "act1-cp-w3-e1",
            "level": 6,
            "monsters": [
              {
                "archetypeId": "monsters/act1.dark-stalker",
                "count": 2
              },
              {
                "archetypeId": "monsters/act1.zombie",
                "count": 2
              }
            ]
          }
        ]
      },
      {
        "id": "w4",
        "type": "treasure",
        "lootTable": "loot/treasure-goblin",
        "encounters": [
          {
            "id": "act1-cp-w4-e1",
            "level": 6,
            "monsters": [
              {
                "archetypeId": "monsters/act1.fallen",
                "count": 1,
                "elite": true
              }
            ]
          }
        ]
      }
    ],
    "challenge": {
      "rotation": [
        "trash",
        "trash",
        "elite",
        "trash"
      ],
      "manualFinalEliteWaves": 2,
      "appendChapterBoss": true,
      "monsterCount": {
        "min": 8,
        "max": 20
      }
    },
    "difficulty": {
      "finaleBand": "none",
      "monsterLevelBonus": 0
    }
  },
  {
    "id": "areas/act1-burial-grounds",
    "name": "maps.area.act1-burial-grounds",
    "actId": "acts/act1",
    "areaLevel": 7,
    "hasBoss": true,
    "lootTable": "loot/trash-act1",
    "flavor": "An open graveyard. Blood Raven walks the rows, raising her former sisters from the earth.",
    "bossEncounter": {
      "id": "act1-burial-grounds-boss",
      "level": 9,
      "monsters": [
        {
          "archetypeId": "monsters/act1.blood-raven",
          "count": 1,
          "boss": true
        },
        {
          "archetypeId": "monsters/act1.bone-warrior",
          "count": 3
        }
      ]
    },
    "waves": [
      {
        "id": "w1",
        "type": "trash",
        "encounters": [
          {
            "id": "act1-bg-w1-e1",
            "level": 7,
            "monsters": [
              {
                "archetypeId": "monsters/act1.zombie",
                "count": 4
              }
            ]
          }
        ]
      },
      {
        "id": "w2",
        "type": "trash",
        "encounters": [
          {
            "id": "act1-bg-w2-e1",
            "level": 7,
            "monsters": [
              {
                "archetypeId": "monsters/act1.bone-warrior",
                "count": 3
              },
              {
                "archetypeId": "monsters/act1.dark-archer",
                "count": 2
              }
            ]
          }
        ]
      },
      {
        "id": "w3",
        "type": "elite",
        "encounters": [
          {
            "id": "act1-bg-w3-e1",
            "level": 8,
            "monsters": [
              {
                "archetypeId": "monsters/act1.bone-warrior",
                "count": 2,
                "elite": true
              },
              {
                "archetypeId": "monsters/act1.zombie",
                "count": 2
              }
            ]
          }
        ]
      },
      {
        "id": "w4",
        "type": "boss",
        "lootTable": "loot/mini-act1",
        "encounters": [
          {
            "id": "act1-bg-w4-e1",
            "level": 9,
            "monsters": [
              {
                "archetypeId": "monsters/act1.blood-raven",
                "count": 1,
                "boss": true
              }
            ]
          }
        ]
      }
    ],
    "challenge": {
      "rotation": [
        "trash",
        "trash",
        "elite",
        "trash"
      ],
      "manualFinalEliteWaves": 2,
      "appendChapterBoss": true,
      "monsterCount": {
        "min": 8,
        "max": 20
      }
    },
    "difficulty": {
      "finaleBand": "none",